root@comp3134-Winter2024:~# tcpdump -n -i eth0
tcpdump: verbose output suppressed, use -v[v]... for full protocol decode
listening on eth0, link-type EN10MB (Ethernet), snapshot length 262144 bytes
00:03:47.661232 IP 143.198.38.41.22 > 205.189.187.4.7210: Flags [P.], seq 882708776:882708884, ack 2602066045, win 501, length 108
00:03:47.661319 IP 143.198.38.41.22 > 205.189.187.4.7210: Flags [P.], seq 108:264, ack 1, win 501, length 156
00:03:47.661492 IP 143.198.38.41.22 > 205.189.187.4.7210: Flags [P.], seq 264:368, ack 1, win 501, length 104
00:03:47.664983 IP 205.189.187.4.7210 > 143.198.38.41.22: Flags [.], ack 108, win 511, length 0
00:03:47.665038 IP 205.189.187.4.7210 > 143.198.38.41.22: Flags [.], ack 368, win 510, length 0
00:03:47.760716 IP 143.198.38.41.22 > 205.189.187.4.7210: Flags [P.], seq 368:532, ack 1, win 501, length 164
00:03:47.760794 IP 143.198.38.41.22 > 205.189.187.4.7210: Flags [P.], seq 532:716, ack 1, win 501, length 184
00:03:47.760922 IP 143.198.38.41.22 > 205.189.187.4.7210: Flags [P.], seq 716:1104, ack 1, win 501, length 388
00:03:47.761005 IP 143.198.38.41.22 > 205.189.187.4.7210: Flags [P.], seq 1104:1272, ack 1, win 501, length 168
00:03:47.764931 IP 205.189.187.4.7210 > 143.198.38.41.22: Flags [.], ack 716, win 508, length 0
00:03:47.765102 IP 205.189.187.4.7210 > 143.198.38.41.22: Flags [.], ack 1272, win 513, length 0
00:03:47.864642 IP 143.198.38.41.22 > 205.189.187.4.7210: Flags [P.], seq 1272:1420, ack 1, win 501, length 148
00:03:47.864717 IP 143.198.38.41.22 > 205.189.187.4.7210: Flags [P.], seq 1420:1604, ack 1, win 501, length 184
00:03:47.864857 IP 143.198.38.41.22 > 205.189.187.4.7210: Flags [P.], seq 1604:2176, ack 1, win 501, length 572
00:03:47.864945 IP 143.198.38.41.22 > 205.189.187.4.7210: Flags [P.], seq 2176:2344, ack 1, win 501, length 168
00:03:47.871789 IP 205.189.187.4.7210 > 143.198.38.41.22: Flags [.], ack 1604, win 511, length 0
00:03:47.871789 IP 205.189.187.4.7210 > 143.198.38.41.22: Flags [.], ack 2344, win 509, length 0
00:03:47.968716 IP 143.198.38.41.22 > 205.189.187.4.7210: Flags [P.], seq 2344:2492, ack 1, win 501, length 148
00:03:47.968844 IP 143.198.38.41.22 > 205.189.187.4.7210: Flags [P.], seq 2492:2676, ack 1, win 501, length 184
00:03:47.969005 IP 143.198.38.41.22 > 205.189.187.4.7210: Flags [P.], seq 2676:3248, ack 1, win 501, length 572
00:03:47.969146 IP 143.198.38.41.22 > 205.189.187.4.7210: Flags [P.], seq 3248:3416, ack 1, win 501, length 168
00:03:47.975104 IP 205.189.187.4.7210 > 143.198.38.41.22: Flags [.], ack 2676, win 507, length 0
00:03:47.975438 IP 205.189.187.4.7210 > 143.198.38.41.22: Flags [.], ack 3416, win 513, length 0
^C
23 packets captured
35 packets received by filter
0 packets dropped by kernel
