root@comp3134-Winter2024:~# tcpdump -r 0001.pcap
reading from file 0001.pcap, link-type EN10MB (Ethernet), snapshot length 262144
23:59:49.285863 IP comp3134-Winter2024.ssh > 205.189.187.4.7210: Flags [P.], seq 882705776:882705820, ack 2602065765, win 501, length 44
23:59:49.285940 IP comp3134-Winter2024.ssh > 205.189.187.4.7210: Flags [P.], seq 44:96, ack 1, win 501, length 52
23:59:49.286039 IP comp3134-Winter2024.ssh > 205.189.187.4.7210: Flags [P.], seq 96:232, ack 1, win 501, length 136
23:59:49.286100 IP comp3134-Winter2024.ssh > 205.189.187.4.7210: Flags [P.], seq 232:268, ack 1, win 501, length 36
23:59:49.289945 IP 205.189.187.4.7210 > comp3134-Winter2024.ssh: Flags [.], ack 44, win 510, length 0
23:59:49.290665 IP 205.189.187.4.7210 > comp3134-Winter2024.ssh: Flags [.], ack 232, win 509, length 0
23:59:49.336051 IP 205.189.187.4.7210 > comp3134-Winter2024.ssh: Flags [.], ack 268, win 509, length 0
23:59:55.736237 IP frcpgh.org.34061 > comp3134-Winter2024.86: Flags [S], seq 295547842, win 65535, length 0
23:59:56.368242 IP 185.196.220.61.44793 > comp3134-Winter2024.2222: Flags [S], seq 4080284430, win 1024, length 0
00:00:00.060002 IP security.criminalip.com.50227 > comp3134-Winter2024.5683: Flags [S], seq 1330560149, win 65535, options [mss 1460], length 0
^C00:00:15.189804 IP 194.26.29.209.53130 > comp3134-Winter2024.20584: Flags [S], seq 2676297936, win 1024, length 0
