root@comp3134-Winter2024:~# tcpdump -A -i eth0
tcpdump: verbose output suppressed, use -v[v]... for full protocol decode
listening on eth0, link-type EN10MB (Ethernet), snapshot length 262144 bytes
23:57:20.118075 IP comp3134-Winter2024.ssh > 205.189.187.4.7210: Flags [P.], seq 880434244:880434352, ack 2602064329, win 501, length 108
E....A@.@..a..&).......*4z\D..Y.P...?8.....     ue.b..N.y.....k.f~s1..AA..Ff,..g.h._.{.....SVo.$.BW...Z.HT..q....6....?.....W)...B....f...3.5..5..V.....
23:57:20.118162 IP comp3134-Winter2024.ssh > 205.189.187.4.7210: Flags [P.], seq 108:264, ack 1, win 501, length 156
E....B@.@..0..&).......*4z\...Y.P...?h.......1....3...R.}...3.o]....[..{..A.F........)w.A.r}Y.@..+...g"....<.................j1ii....."....)F?}c..j"...3..NTA....I.j..%P.....?..Eq..
...k..p@Q.A...b
23:57:20.118202 IP comp3134-Winter2024.ssh > 205.189.187.4.7210: Flags [P.], seq 264:332, ack 1, win 501, length 68
E..l.C@.@.....&).......*4z]L..Y.P...?......|....a..[.8. ..W~.....|..w..R.'...\...[.]..&..h...U;1._...&....X
23:57:20.118247 IP comp3134-Winter2024.ssh > 205.189.187.4.7210: Flags [P.], seq 332:368, ack 1, win 501, length 36
E..L.D@.@.....&).......*4z]...Y.P...>......<I...J=n.b2...,v..P............E.
23:57:20.121862 IP 205.189.187.4.7210 > comp3134-Winter2024.ssh: Flags [.], ack 108, win 513, length 0
E..(.x@.q.........&).*....Y.4z\.P.........
23:57:20.122667 IP 205.189.187.4.7210 > comp3134-Winter2024.ssh: Flags [.], ack 332, win 512, length 0
E..(.y@.q.........&).*....Y.4z].P.........
23:57:20.167867 IP 205.189.187.4.7210 > comp3134-Winter2024.ssh: Flags [.], ack 368, win 512, length 0
E..(.z@.q.........&).*....Y.4z].P.........
^C
7 packets captured
45 packets received by filter
0 packets dropped by kernel
