root@comp3134-Winter2024:~# tcpdump -i eth0 dst 143.198.38.41
tcpdump: verbose output suppressed, use -v[v]... for full protocol decode
listening on eth0, link-type EN10MB (Ethernet), snapshot length 262144 bytes
00:09:34.635097 IP 205.189.187.4.7210 > comp3134-Winter2024.ssh: Flags [.], ack 882755300, win 512, length 0
00:09:34.635206 IP 205.189.187.4.7210 > comp3134-Winter2024.ssh: Flags [.], ack 261, win 511, length 0
00:09:34.729394 IP 67.207.67.2.domain > comp3134-Winter2024.35324: 27174 NXDomain 0/1/1 (122)
00:09:34.729891 IP 67.207.67.2.domain > comp3134-Winter2024.35324: 27174 NXDomain 0/1/0 (111)
00:09:34.730839 IP 67.207.67.2.domain > comp3134-Winter2024.48275: 43505 NXDomain 0/1/1 (109)
00:09:34.730839 IP 67.207.67.2.domain > comp3134-Winter2024.57104: Flags [S.], seq 806114384, ack 1525435966, win 65160, options [mss 1460,sackOK,TS val 3552181429 ecr 1331451951,nop,wscale 9], length 0
00:09:34.730889 IP 67.207.67.2.domain > comp3134-Winter2024.34161: 63426 NXDomain 0/1/1 (109)
00:09:34.731269 IP 67.207.67.2.domain > comp3134-Winter2024.48275: 43505 NXDomain 0/1/0 (98)
00:09:34.731290 IP 67.207.67.2.domain > comp3134-Winter2024.34161: 63426 NXDomain 0/1/0 (98)
00:09:34.731317 IP 67.207.67.2.domain > comp3134-Winter2024.57104: Flags [.], ack 47, win 128, options [nop,nop,TS val 3552181429 ecr 1331451951], length 0
00:09:34.731525 IP 67.207.67.2.domain > comp3134-Winter2024.57104: Flags [P.], seq 1:101, ack 47, win 128, options [nop,nop,TS val 3552181429 ecr 1331451951], length 100 41387 NXDomain 0/1/0 (98)
00:09:34.745779 IP 205.189.187.4.7210 > comp3134-Winter2024.ssh: Flags [.], ack 445, win 510, length 0
00:09:34.745955 IP 205.189.187.4.7210 > comp3134-Winter2024.ssh: Flags [.], ack 621, win 509, length 0
^C
13 packets captured
20 packets received by filter
0 packets dropped by kernel
