root@comp3134-Winter2024:~# tcpdump -i eth0 port 22
tcpdump: verbose output suppressed, use -v[v]... for full protocol decode
listening on eth0, link-type EN10MB (Ethernet), snapshot length 262144 bytes
00:05:20.813306 IP comp3134-Winter2024.ssh > 205.189.187.4.7210: Flags [P.], seq 882732760:882732812, ack 2602066449, win 501, length 52
00:05:20.813844 IP comp3134-Winter2024.ssh > 205.189.187.4.7210: Flags [P.], seq 52:160, ack 1, win 501, length 108
00:05:20.813914 IP comp3134-Winter2024.ssh > 205.189.187.4.7210: Flags [P.], seq 160:316, ack 1, win 501, length 156
00:05:20.813960 IP comp3134-Winter2024.ssh > 205.189.187.4.7210: Flags [P.], seq 316:420, ack 1, win 501, length 104
00:05:20.817434 IP 205.189.187.4.7210 > comp3134-Winter2024.ssh: Flags [.], ack 160, win 511, length 0
00:05:20.817434 IP 205.189.187.4.7210 > comp3134-Winter2024.ssh: Flags [.], ack 420, win 510, length 0
^C
6 packets captured
15 packets received by filter
0 packets dropped by kernel
